{
  "breaks": [],
  "case_id": "case_01_clean_small",
  "description": "All rows match; no breaks. False-positive pressure.",
  "matches": [
    {
      "a_row_id": "A1001",
      "b_row_id": "B5001"
    },
    {
      "a_row_id": "A1002",
      "b_row_id": "B5002"
    },
    {
      "a_row_id": "A1003",
      "b_row_id": "B5003"
    },
    {
      "a_row_id": "A1004",
      "b_row_id": "B5004"
    },
    {
      "a_row_id": "A1005",
      "b_row_id": "B5005"
    },
    {
      "a_row_id": "A1006",
      "b_row_id": "B5006"
    },
    {
      "a_row_id": "A1007",
      "b_row_id": "B5007"
    },
    {
      "a_row_id": "A1008",
      "b_row_id": "B5008"
    },
    {
      "a_row_id": "A1009",
      "b_row_id": "B5009"
    },
    {
      "a_row_id": "A1010",
      "b_row_id": "B5010"
    },
    {
      "a_row_id": "A1011",
      "b_row_id": "B5011"
    },
    {
      "a_row_id": "A1012",
      "b_row_id": "B5012"
    }
  ],
  "schema_version": "1.0",
  "seed": 777001
}
