{
  "breaks": [
    {
      "a_row_ids": [],
      "b_row_ids": [
        "B5011",
        "B5011D"
      ],
      "break_id": "GT-001",
      "break_type": "DUPLICATE",
      "expected_difference": 346.29,
      "notes": "B rows B5011/B5011D book the same economic transaction twice."
    },
    {
      "a_row_ids": [],
      "b_row_ids": [
        "B5012",
        "B5012D"
      ],
      "break_id": "GT-002",
      "break_type": "DUPLICATE",
      "expected_difference": 962.54,
      "notes": "B rows B5012/B5012D book the same economic transaction twice."
    }
  ],
  "case_id": "case_10_duplicates",
  "description": "Two duplicated transactions in B.",
  "matches": [
    {
      "a_row_id": "A1001",
      "b_row_id": "B5001"
    },
    {
      "a_row_id": "A1002",
      "b_row_id": "B5002"
    },
    {
      "a_row_id": "A1003",
      "b_row_id": "B5003"
    },
    {
      "a_row_id": "A1004",
      "b_row_id": "B5004"
    },
    {
      "a_row_id": "A1005",
      "b_row_id": "B5005"
    },
    {
      "a_row_id": "A1006",
      "b_row_id": "B5006"
    },
    {
      "a_row_id": "A1007",
      "b_row_id": "B5007"
    },
    {
      "a_row_id": "A1008",
      "b_row_id": "B5008"
    },
    {
      "a_row_id": "A1009",
      "b_row_id": "B5009"
    },
    {
      "a_row_id": "A1010",
      "b_row_id": "B5010"
    },
    {
      "a_row_id": "A1011",
      "b_row_id": "B5011"
    },
    {
      "a_row_id": "A1012",
      "b_row_id": "B5012"
    }
  ],
  "schema_version": "1.0",
  "seed": 777010
}
