{
  "breaks": [
    {
      "a_row_ids": [],
      "b_row_ids": [
        "B5011"
      ],
      "break_id": "GT-001",
      "break_type": "MISSING_IN_A",
      "expected_difference": 583.87,
      "notes": "B row B5011 (net 583.87) has no A counterpart."
    },
    {
      "a_row_ids": [],
      "b_row_ids": [
        "B5012"
      ],
      "break_id": "GT-002",
      "break_type": "MISSING_IN_A",
      "expected_difference": 522.62,
      "notes": "B row B5012 (net 522.62) has no A counterpart."
    }
  ],
  "case_id": "case_04_missing_in_a",
  "description": "Two B rows absent from A.",
  "matches": [
    {
      "a_row_id": "A1001",
      "b_row_id": "B5001"
    },
    {
      "a_row_id": "A1002",
      "b_row_id": "B5002"
    },
    {
      "a_row_id": "A1003",
      "b_row_id": "B5003"
    },
    {
      "a_row_id": "A1004",
      "b_row_id": "B5004"
    },
    {
      "a_row_id": "A1005",
      "b_row_id": "B5005"
    },
    {
      "a_row_id": "A1006",
      "b_row_id": "B5006"
    },
    {
      "a_row_id": "A1007",
      "b_row_id": "B5007"
    },
    {
      "a_row_id": "A1008",
      "b_row_id": "B5008"
    },
    {
      "a_row_id": "A1009",
      "b_row_id": "B5009"
    },
    {
      "a_row_id": "A1010",
      "b_row_id": "B5010"
    }
  ],
  "schema_version": "1.0",
  "seed": 42004
}
