{
  "breaks": [
    {
      "a_row_ids": [
        "A1011"
      ],
      "b_row_ids": [],
      "break_id": "GT-001",
      "break_type": "MISSING_IN_B",
      "expected_difference": 23.25,
      "notes": "A row A1011 (net 23.25) has no B counterpart."
    },
    {
      "a_row_ids": [
        "A1012"
      ],
      "b_row_ids": [],
      "break_id": "GT-002",
      "break_type": "MISSING_IN_B",
      "expected_difference": 787.61,
      "notes": "A row A1012 (net 787.61) has no B counterpart."
    }
  ],
  "case_id": "case_03_missing_in_b",
  "description": "Two A rows absent from B.",
  "matches": [
    {
      "a_row_id": "A1001",
      "b_row_id": "B5001"
    },
    {
      "a_row_id": "A1002",
      "b_row_id": "B5002"
    },
    {
      "a_row_id": "A1003",
      "b_row_id": "B5003"
    },
    {
      "a_row_id": "A1004",
      "b_row_id": "B5004"
    },
    {
      "a_row_id": "A1005",
      "b_row_id": "B5005"
    },
    {
      "a_row_id": "A1006",
      "b_row_id": "B5006"
    },
    {
      "a_row_id": "A1007",
      "b_row_id": "B5007"
    },
    {
      "a_row_id": "A1008",
      "b_row_id": "B5008"
    },
    {
      "a_row_id": "A1009",
      "b_row_id": "B5009"
    },
    {
      "a_row_id": "A1010",
      "b_row_id": "B5010"
    }
  ],
  "schema_version": "1.0",
  "seed": 777003
}
