{
  "breaks": [
    {
      "a_row_ids": [
        "A1009",
        "A1010"
      ],
      "b_row_ids": [
        "B5009",
        "B5010"
      ],
      "break_id": "GT-001",
      "break_type": "AMBIGUOUS",
      "expected_difference": 0.0,
      "notes": "Two identical-amount same-day rows on each side; references unusable; correspondence cannot be established from data."
    }
  ],
  "case_id": "case_11_ambiguous",
  "description": "Identical-amount same-day rows with unusable references.",
  "matches": [
    {
      "a_row_id": "A1001",
      "b_row_id": "B5001"
    },
    {
      "a_row_id": "A1002",
      "b_row_id": "B5002"
    },
    {
      "a_row_id": "A1003",
      "b_row_id": "B5003"
    },
    {
      "a_row_id": "A1004",
      "b_row_id": "B5004"
    },
    {
      "a_row_id": "A1005",
      "b_row_id": "B5005"
    },
    {
      "a_row_id": "A1006",
      "b_row_id": "B5006"
    },
    {
      "a_row_id": "A1007",
      "b_row_id": "B5007"
    },
    {
      "a_row_id": "A1008",
      "b_row_id": "B5008"
    }
  ],
  "schema_version": "1.0",
  "seed": 42011
}
