{
  "breaks": [
    {
      "a_row_ids": [
        "A1011"
      ],
      "b_row_ids": [
        "B5011"
      ],
      "break_id": "GT-001",
      "break_type": "AMOUNT_MISMATCH",
      "expected_difference": 0.75,
      "notes": "Gross differs by 0.75: A 775.49 vs B 776.24."
    },
    {
      "a_row_ids": [
        "A1012"
      ],
      "b_row_ids": [
        "B5012"
      ],
      "break_id": "GT-002",
      "break_type": "AMOUNT_MISMATCH",
      "expected_difference": -0.75,
      "notes": "Gross differs by -0.75: A 168.47 vs B 167.72."
    }
  ],
  "case_id": "case_14_aggregate_trap",
  "description": "Aggregate totals equal on gross and net while two offsetting amount errors (+0.75 / -0.75) exist.",
  "matches": [
    {
      "a_row_id": "A1001",
      "b_row_id": "B5001"
    },
    {
      "a_row_id": "A1002",
      "b_row_id": "B5002"
    },
    {
      "a_row_id": "A1003",
      "b_row_id": "B5003"
    },
    {
      "a_row_id": "A1004",
      "b_row_id": "B5004"
    },
    {
      "a_row_id": "A1005",
      "b_row_id": "B5005"
    },
    {
      "a_row_id": "A1006",
      "b_row_id": "B5006"
    },
    {
      "a_row_id": "A1007",
      "b_row_id": "B5007"
    },
    {
      "a_row_id": "A1008",
      "b_row_id": "B5008"
    },
    {
      "a_row_id": "A1009",
      "b_row_id": "B5009"
    },
    {
      "a_row_id": "A1010",
      "b_row_id": "B5010"
    }
  ],
  "schema_version": "1.0",
  "seed": 777014
}
