{
  "breaks": [
    {
      "a_row_ids": [
        "A1011"
      ],
      "b_row_ids": [
        "B5011"
      ],
      "break_id": "GT-001",
      "break_type": "COMPOUND",
      "component_causes": [
        "FEE_MISMATCH",
        "FX_DIFFERENCE"
      ],
      "expected_difference": 0.86,
      "notes": "FX: 1234.50 EUR @ 1.0857 -> A HALF_UP 1340.30 vs B DOWN 1340.29 (-0.01); fee A 2.50 vs B 3.35 (+0.85); net diff 0.86."
    }
  ],
  "case_id": "case_12_compound",
  "description": "Fee mismatch and FX difference on the same correspondence.",
  "matches": [
    {
      "a_row_id": "A1001",
      "b_row_id": "B5001"
    },
    {
      "a_row_id": "A1002",
      "b_row_id": "B5002"
    },
    {
      "a_row_id": "A1003",
      "b_row_id": "B5003"
    },
    {
      "a_row_id": "A1004",
      "b_row_id": "B5004"
    },
    {
      "a_row_id": "A1005",
      "b_row_id": "B5005"
    },
    {
      "a_row_id": "A1006",
      "b_row_id": "B5006"
    },
    {
      "a_row_id": "A1007",
      "b_row_id": "B5007"
    },
    {
      "a_row_id": "A1008",
      "b_row_id": "B5008"
    },
    {
      "a_row_id": "A1009",
      "b_row_id": "B5009"
    },
    {
      "a_row_id": "A1010",
      "b_row_id": "B5010"
    }
  ],
  "schema_version": "1.0",
  "seed": 42012
}
