{
  "breaks": [
    {
      "a_row_ids": [
        "A1010"
      ],
      "b_row_ids": [
        "B5010"
      ],
      "break_id": "GT-001",
      "break_type": "FX_DIFFERENCE",
      "expected_difference": 0.01,
      "notes": "Same INR 4441.04 @ 1.0679: A HALF_UP 4742.59, B DOWN 4742.58."
    },
    {
      "a_row_ids": [
        "A1011"
      ],
      "b_row_ids": [
        "B5011"
      ],
      "break_id": "GT-002",
      "break_type": "FX_DIFFERENCE",
      "expected_difference": 0.01,
      "notes": "Same INR 805.46 @ 0.9408: A HALF_UP 757.78, B DOWN 757.77."
    }
  ],
  "case_id": "case_08_fx_difference",
  "description": "Two FX rounding-mode divergences (HALF_UP vs DOWN).",
  "matches": [
    {
      "a_row_id": "A1001",
      "b_row_id": "B5001"
    },
    {
      "a_row_id": "A1002",
      "b_row_id": "B5002"
    },
    {
      "a_row_id": "A1003",
      "b_row_id": "B5003"
    },
    {
      "a_row_id": "A1004",
      "b_row_id": "B5004"
    },
    {
      "a_row_id": "A1005",
      "b_row_id": "B5005"
    },
    {
      "a_row_id": "A1006",
      "b_row_id": "B5006"
    },
    {
      "a_row_id": "A1007",
      "b_row_id": "B5007"
    },
    {
      "a_row_id": "A1008",
      "b_row_id": "B5008"
    }
  ],
  "schema_version": "1.0",
  "seed": 42008
}
