{
  "breaks": [
    {
      "a_row_ids": [
        "A1011"
      ],
      "b_row_ids": [
        "B5011"
      ],
      "break_id": "GT-001",
      "break_type": "ROUNDING_DIFFERENCE",
      "expected_difference": 0.01,
      "notes": "One-cent difference within tolerance: A 271.41 vs B 271.40."
    },
    {
      "a_row_ids": [
        "A1012"
      ],
      "b_row_ids": [
        "B5012"
      ],
      "break_id": "GT-002",
      "break_type": "ROUNDING_DIFFERENCE",
      "expected_difference": 0.01,
      "notes": "One-cent difference within tolerance: A 144.64 vs B 144.63."
    }
  ],
  "case_id": "case_09_rounding",
  "description": "Two one-cent differences within tolerance.",
  "matches": [
    {
      "a_row_id": "A1001",
      "b_row_id": "B5001"
    },
    {
      "a_row_id": "A1002",
      "b_row_id": "B5002"
    },
    {
      "a_row_id": "A1003",
      "b_row_id": "B5003"
    },
    {
      "a_row_id": "A1004",
      "b_row_id": "B5004"
    },
    {
      "a_row_id": "A1005",
      "b_row_id": "B5005"
    },
    {
      "a_row_id": "A1006",
      "b_row_id": "B5006"
    },
    {
      "a_row_id": "A1007",
      "b_row_id": "B5007"
    },
    {
      "a_row_id": "A1008",
      "b_row_id": "B5008"
    },
    {
      "a_row_id": "A1009",
      "b_row_id": "B5009"
    },
    {
      "a_row_id": "A1010",
      "b_row_id": "B5010"
    }
  ],
  "schema_version": "1.0",
  "seed": 777009
}
